{
  "id": "11111111-1111-1111-1111-111111111111",
  "name": "Staging Vulnerability Lab",
  "allowed_domains": [
    "lab.valutx.local",
    "dvwa.internal"
  ],
  "allowed_cidrs": [
    "192.168.100.0/24",
    "10.10.10.0/24"
  ],
  "allowed_ports": [
    80,
    443,
    8080
  ],
  "max_depth": 3,
  "created_by": "sec-lead@valutx.org",
  "expires_at": "2026-10-02T20:00:00Z",
  "scope_hash": "e3b0c44298fc1c149afbf4c8996fb92427ae41e4649b934ca495991b7852b855"
}
